{
  "version": "2.0",
  "words": [
    {
      "sites": [
        [
          0,
          0
        ],
        [
          1,
          0
        ],
        [
          2,
          0
        ],
        [
          3,
          0
        ],
        [
          4,
          0
        ],
        [
          0,
          1
        ],
        [
          1,
          1
        ],
        [
          2,
          1
        ],
        [
          3,
          1
        ],
        [
          4,
          1
        ]
      ]
    },
    {
      "sites": [
        [
          0,
          2
        ],
        [
          1,
          2
        ],
        [
          2,
          2
        ],
        [
          3,
          2
        ],
        [
          4,
          2
        ],
        [
          0,
          3
        ],
        [
          1,
          3
        ],
        [
          2,
          3
        ],
        [
          3,
          3
        ],
        [
          4,
          3
        ]
      ]
    }
  ],
  "zones": [
    {
      "name": "",
      "grid": {
        "x_start": 1.0,
        "y_start": 2.5,
        "x_spacing": [
          2.0,
          2.0,
          2.0,
          2.0
        ],
        "y_spacing": [
          2.5,
          7.5,
          2.5
        ]
      },
      "site_buses": [
        {
          "src": [
            0,
            1,
            2,
            3,
            4
          ],
          "dst": [
            5,
            6,
            7,
            8,
            9
          ]
        }
      ],
      "word_buses": [
        {
          "src": [
            0
          ],
          "dst": [
            1
          ]
        }
      ],
      "words_with_site_buses": [
        0,
        1
      ],
      "sites_with_word_buses": [
        5,
        6,
        7,
        8,
        9
      ],
      "entangling_pairs": [
        [
          0,
          1
        ]
      ]
    }
  ],
  "zone_buses": [],
  "modes": [
    {
      "name": "default",
      "zones": [
        0
      ],
      "bitstring_order": []
    }
  ],
  "paths": [
    {
      "lane": "0x0000000000000000",
      "waypoints": [
        [
          1.0,
          2.5
        ],
        [
          1.0,
          5.0
        ]
      ]
    },
    {
      "lane": "0x8000000000000000",
      "waypoints": [
        [
          1.0,
          5.0
        ],
        [
          6.0,
          5.0
        ],
        [
          6.0,
          2.5
        ],
        [
          1.0,
          2.5
        ]
      ]
    }
  ],
  "feed_forward": false,
  "atom_reloading": false
}
