{
  "version": "2.0",
  "words": [
    {
      "sites": [
        [
          0,
          0
        ],
        [
          1,
          0
        ],
        [
          2,
          0
        ],
        [
          3,
          0
        ]
      ]
    },
    {
      "sites": [
        [
          0,
          1
        ],
        [
          1,
          1
        ],
        [
          2,
          1
        ],
        [
          3,
          1
        ]
      ]
    },
    {
      "sites": [
        [
          0,
          2
        ],
        [
          1,
          2
        ],
        [
          2,
          2
        ],
        [
          3,
          2
        ]
      ]
    },
    {
      "sites": [
        [
          0,
          3
        ],
        [
          1,
          3
        ],
        [
          2,
          3
        ],
        [
          3,
          3
        ]
      ]
    },
    {
      "sites": [
        [
          0,
          0
        ],
        [
          1,
          0
        ],
        [
          2,
          0
        ],
        [
          3,
          0
        ]
      ]
    },
    {
      "sites": [
        [
          0,
          1
        ],
        [
          1,
          1
        ],
        [
          2,
          1
        ],
        [
          3,
          1
        ]
      ]
    },
    {
      "sites": [
        [
          0,
          2
        ],
        [
          1,
          2
        ],
        [
          2,
          2
        ],
        [
          3,
          2
        ]
      ]
    },
    {
      "sites": [
        [
          0,
          3
        ],
        [
          1,
          3
        ],
        [
          2,
          3
        ],
        [
          3,
          3
        ]
      ]
    }
  ],
  "zones": [
    {
      "name": "storage",
      "grid": {
        "x_start": 0.0,
        "y_start": 0.0,
        "x_spacing": [
          2.0,
          2.0,
          2.0
        ],
        "y_spacing": [
          2.0,
          2.0,
          2.0
        ]
      },
      "site_buses": [
        {
          "src": [
            0,
            2
          ],
          "dst": [
            1,
            3
          ]
        },
        {
          "src": [
            1
          ],
          "dst": [
            2
          ]
        }
      ],
      "word_buses": [
        {
          "src": [
            0,
            2
          ],
          "dst": [
            1,
            3
          ]
        },
        {
          "src": [
            1
          ],
          "dst": [
            2
          ]
        }
      ],
      "words_with_site_buses": [
        0,
        1,
        2,
        3
      ],
      "sites_with_word_buses": [
        0,
        3
      ],
      "entangling_pairs": []
    },
    {
      "name": "gate",
      "grid": {
        "x_start": 0.0,
        "y_start": 20.0,
        "x_spacing": [
          2.0,
          2.0,
          2.0
        ],
        "y_spacing": [
          2.0,
          2.0,
          2.0
        ]
      },
      "site_buses": [
        {
          "src": [
            0,
            2
          ],
          "dst": [
            1,
            3
          ]
        },
        {
          "src": [
            1
          ],
          "dst": [
            2
          ]
        }
      ],
      "word_buses": [
        {
          "src": [
            4,
            6
          ],
          "dst": [
            5,
            7
          ]
        },
        {
          "src": [
            5
          ],
          "dst": [
            6
          ]
        }
      ],
      "words_with_site_buses": [
        4,
        5,
        6,
        7
      ],
      "sites_with_word_buses": [
        0,
        3
      ],
      "entangling_pairs": [
        [
          4,
          5
        ],
        [
          6,
          7
        ]
      ]
    }
  ],
  "zone_buses": [
    {
      "src": [
        {
          "zone_id": 0,
          "word_id": 3
        }
      ],
      "dst": [
        {
          "zone_id": 1,
          "word_id": 4
        }
      ]
    }
  ],
  "modes": [
    {
      "name": "default",
      "zones": [
        0,
        1
      ],
      "bitstring_order": []
    }
  ]
}
