{
  "version": "2.0",
  "words": [
    {
      "sites": [
        [
          0,
          0
        ],
        [
          1,
          0
        ],
        [
          2,
          0
        ]
      ]
    },
    {
      "sites": [
        [
          0,
          1
        ],
        [
          1,
          1
        ],
        [
          2,
          1
        ]
      ]
    }
  ],
  "zones": [
    {
      "grid": {
        "x_start": 0.0,
        "y_start": 0.0,
        "x_spacing": [
          2.0,
          2.0
        ],
        "y_spacing": [
          2.0
        ]
      },
      "site_buses": [
        {
          "src": [
            0,
            1
          ],
          "dst": [
            1,
            2
          ]
        }
      ],
      "word_buses": [
        {
          "src": [
            0
          ],
          "dst": [
            1
          ]
        }
      ],
      "words_with_site_buses": [
        0,
        1
      ],
      "sites_with_word_buses": [
        0,
        1,
        2
      ],
      "entangling_pairs": []
    }
  ],
  "zone_buses": [],
  "modes": [
    {
      "name": "default",
      "zones": [
        0
      ],
      "bitstring_order": []
    }
  ]
}
