{
  "version": "2.0",
  "words": [
    { "sites": [[0, 0]] },
    { "sites": [[1, 0]] },
    { "sites": [[2, 0]] },
    { "sites": [[3, 0]] },
    { "sites": [[0, 1]] },
    { "sites": [[1, 1]] },
    { "sites": [[2, 1]] },
    { "sites": [[3, 1]] },
    { "sites": [[0, 2]] },
    { "sites": [[1, 2]] },
    { "sites": [[2, 2]] },
    { "sites": [[3, 2]] },
    { "sites": [[0, 3]] },
    { "sites": [[1, 3]] },
    { "sites": [[2, 3]] },
    { "sites": [[3, 3]] },
    { "sites": [[0, 4]] },
    { "sites": [[1, 4]] },
    { "sites": [[2, 4]] },
    { "sites": [[3, 4]] }
  ],
  "zones": [
    {
      "name": "gate",
      "grid": {
        "x_start": 0.0,
        "y_start": 0.0,
        "x_spacing": [2.0, 8.0, 2.0],
        "y_spacing": [10.0, 10.0, 10.0, 10.0]
      },
      "site_buses": [],
      "word_buses": [
        {
          "src": [0, 4, 8, 12, 16],
          "dst": [1, 5, 9, 13, 17]
        },
        {
          "src": [2, 6, 10, 14, 18],
          "dst": [3, 7, 11, 15, 19]
        },
        {
          "src": [0, 4, 8, 12],
          "dst": [5, 9, 13, 17]
        },
        {
          "src": [2, 6, 10, 14],
          "dst": [7, 11, 15, 19]
        },
        { "src": [0, 4, 8], "dst": [9, 13, 17] },
        { "src": [2, 6, 10], "dst": [11, 15, 19] },

        { "src": [0, 4], "dst": [13, 17] },
        { "src": [2, 6], "dst": [15, 19] },

        { "src": [0], "dst": [17] },
        { "src": [2], "dst": [19] },
        {
          "src": [4, 8, 12, 16],
          "dst": [1, 5, 9, 13]
        },
        {
          "src": [6, 10, 14, 18],
          "dst": [3, 7, 11, 15]
        },
        { "src": [8, 12, 16], "dst": [1, 5, 9] },
        { "src": [10, 14, 18], "dst": [3, 7, 11] },
        { "src": [12, 16], "dst": [1, 5] },
        { "src": [14, 18], "dst": [3, 7] },
        { "src": [16], "dst": [1] },
        { "src": [18], "dst": [3] },
        { "src": [1, 5, 9, 13, 17], "dst": [3, 7, 11, 15, 19] }
      ],
      "words_with_site_buses": [],
      "sites_with_word_buses": [0],
      "entangling_pairs": [
        [0, 1],
        [2, 3],
        [4, 5],
        [6, 7],
        [8, 9],
        [10, 11],
        [12, 13],
        [14, 15],
        [16, 17],
        [18, 19]
      ]
    }
  ],
  "zone_buses": [],
  "modes": [
    { "name": "all", "zones": [0], "bitstring_order": [] },
    { "name": "gate", "zones": [0], "bitstring_order": [] }
  ]
}
